{
  "id": "administrators",
  "label": "Administrateurs",
  "description": "Utilisateurs de profil administration.",
  "enabled": true,
  "legal_basis": "legitimate_interest_product_updates",
  "conditions": {
    "all": [
      { "field": "active", "operator": "equals", "value": true },
      { "field": "communication_eligible", "operator": "equals", "value": true },
      { "field": "role_key", "operator": "in", "value": ["administrator", "admin"] }
    ]
  },
  "exclusions": ["opted_out", "invalid_email", "account_suspended"]
}
