{
  "id": "risk_managers",
  "label": "Responsables risques",
  "description": "Profils risques identifies par role.",
  "enabled": true,
  "legal_basis": "legitimate_interest_product_updates",
  "conditions": {
    "all": [
      { "field": "active", "operator": "equals", "value": true },
      { "field": "communication_eligible", "operator": "equals", "value": true },
      { "field": "role_key", "operator": "in", "value": ["risk_manager", "risk_officer"] }
    ]
  },
  "exclusions": ["opted_out", "invalid_email", "account_suspended"]
}
